62364, win 516, length 0
01:04:38.112663 IP 138.197.150.181.22 > 142.114.108.182.49172: Flags [P.], seq 5871092:5871472, ack 3313, win 501, length 380
01:04:38.112733 IP 138.197.150.181.22 > 142.114.108.182.49172: Flags [P.], seq 5871472:5871636, ack 3313, win 501, length 164
01:04:38.112793 IP 138.197.150.181.22 > 142.114.108.182.49172: Flags [P.], seq 5871636:5871800, ack 3313, win 501, length 164
01:04:38.112859 IP 138.197.150.181.22 > 142.114.108.182.49172: Flags [P.], seq 5871800:5871964, ack 3313, win 501, length 164
01:04:38.112925 IP 138.197.150.181.22 > 142.114.108.182.49172: Flags [P.], seq 5871964:5872128, ack 3313, win 501, length 164
01:04:38.112991 IP 138.197.150.181.22 > 142.114.108.182.49172: Flags [P.], seq 5872128:5872292, ack 3313, win 501, length 164
01:04:38.113063 IP 138.197.150.181.22 > 142.114.108.182.49172: Flags [P.], seq 5872292:5872456, ack 3313, win 501, length 164
01:04:38.113118 IP 138.197.150.181.22 > 142.114.108.182.49172: Flags [P.], seq 5872456:5872620, ack 3313, win 501, length 164
01:04:38.113176 IP 138.197.150.181.22 > 142.114.108.182.49172: Flags [P.], seq 5872620:5872784, ack 3313, win 501, length 164
01:04:38.113202 IP 142.114.108.182.49172 > 138.197.150.181.22: Flags [.], ack 5862856, win 514, length 0
01:04:38.113219 IP 142.114.108.182.49172 > 138.197.150.181.22: Flags [.], ack 5864540, win 516, length 0
01:04:38.113226 IP 142.114.108.182.49172 > 138.197.150.181.22: Flags [P.], seq 3313:3349, ack 5865136, win 513, length 36
^C
37320 packets captured
37321 packets received by filter
0 packets dropped by kernel
