01:06:12.328729 IP 138.197.150.181.ssh > bras-base-toroon0411w-grc-46-142-114-108-182.dsl.bell.ca.49172: Flags [P.], seq 4932868:4933072, ack 2953, win 501, length 204
01:06:12.328828 IP 138.197.150.181.ssh > bras-base-toroon0411w-grc-46-142-114-108-182.dsl.bell.ca.49172: Flags [P.], seq 4933072:4933276, ack 2953, win 501, length 204
01:06:12.328904 IP 138.197.150.181.ssh > bras-base-toroon0411w-grc-46-142-114-108-182.dsl.bell.ca.49172: Flags [P.], seq 4933276:4933480, ack 2953, win 501, length 204
01:06:12.328982 IP 138.197.150.181.ssh > bras-base-toroon0411w-grc-46-142-114-108-182.dsl.bell.ca.49172: Flags [P.], seq 4933480:4933684, ack 2953, win 501, length 204
01:06:12.329079 IP 138.197.150.181.ssh > bras-base-toroon0411w-grc-46-142-114-108-182.dsl.bell.ca.49172: Flags [P.], seq 4933684:4933888, ack 2953, win 501, length 204
01:06:12.329176 IP 138.197.150.181.ssh > bras-base-toroon0411w-grc-46-142-114-108-182.dsl.bell.ca.49172: Flags [P.], seq 4933888:4934092, ack 2953, win 501, length 204
01:06:12.329276 IP 138.197.150.181.ssh > bras-base-toroon0411w-grc-46-142-114-108-182.dsl.bell.ca.49172: Flags [P.], seq 4934092:4934296, ack 2953, win 501, length 204
01:06:12.329327 IP bras-base-toroon0411w-grc-46-142-114-108-182.dsl.bell.ca.49172 > 138.197.150.181.ssh: Flags [.], ack 4921324, win 516, length 0
01:06:12.329339 IP bras-base-toroon0411w-grc-46-142-114-108-182.dsl.bell.ca.49172 > 138.197.150.181.ssh: Flags [.], ack 4924944, win 516, length 0
^C
24969 packets captured
24971 packets received by filter
0 packets dropped by kernel
