root@lamp-ubuntu-s-1vcpu-1gb-tor1-01:~# tcpdump -c 5 -i eth0
tcpdump: verbose output suppressed, use -v or -vv for full protocol decode
listening on eth0, link-type EN10MB (Ethernet), capture size 262144 bytes
00:54:42.165106 IP 138.197.150.181.ssh > bras-base-toroon0411w-grc-46-142-114-108-182.dsl.bell.ca.49172: Flags [P.], seq 1356240119:1356240227, ack 1296510813, win 501, length 108
00:54:42.165198 IP 138.197.150.181.ssh > bras-base-toroon0411w-grc-46-142-114-108-182.dsl.bell.ca.49172: Flags [P.], seq 108:144, ack 1, win 501, length 36
00:54:42.165271 IP 138.197.150.181.ssh > bras-base-toroon0411w-grc-46-142-114-108-182.dsl.bell.ca.49172: Flags [P.], seq 144:252, ack 1, win 501, length 108
00:54:42.165336 IP 138.197.150.181.ssh > bras-base-toroon0411w-grc-46-142-114-108-182.dsl.bell.ca.49172: Flags [P.], seq 252:288, ack 1, win 501, length 36
00:54:42.165899 IP 138.197.150.181.59765 > dns.google.domain: 17412+ PTR? 182.108.114.142.in-addr.arpa. (46)
5 packets captured
21 packets received by filter
0 packets dropped by kernel
