root@lamp-ubuntu-s-1vcpu-1gb-tor1-01:~# tcpdump -w 0001.pcap -i eth0
tcpdump: listening on eth0, link-type EN10MB (Ethernet), capture size 262144 bytes
^C82 packets captured
84 packets received by filter
0 packets dropped by kernel
root@lamp-ubuntu-s-1vcpu-1gb-tor1-01:~# tcpdump -r 0001.pcap
reading from file 0001.pcap, link-type EN10MB (Ethernet)
01:01:13.180748 IP 138.197.150.181.ssh > bras-base-toroon0411w-grc-46-142-114-108-182.dsl.bell.ca.49172: Flags [P.], seq 1369872055:1369872099, ack 1296519317, win 501, length 44
01:01:13.180824 IP 138.197.150.181.ssh > bras-base-toroon0411w-grc-46-142-114-108-182.dsl.bell.ca.49172: Flags [P.], seq 44:152, ack 1, win 501, length 108
01:01:13.180912 IP 138.197.150.181.ssh > bras-base-toroon0411w-grc-46-142-114-108-182.dsl.bell.ca.49172: Flags [P.], seq 152:188, ack 1, win 501, length 36
01:01:13.184337 IP bras-base-toroon0411w-grc-46-142-114-108-182.dsl.bell.ca.49172 > 138.197.150.181.ssh: Flags [.], ack 188, win 515, length 0
01:01:15.884333 IP trm.trimais.com.br.57320 > 138.197.150.181.ssh: Flags [S], seq 2943762018, win 29200, options [mss 1460,sackOK,TS val 315363091 ecr 0,nop,wscale 7], length 0
01:01:15.884394 IP 138.197.150.181.ssh > trm.trimais.com.br.57320: Flags [S.], seq 1259924793, ack 2943762019, win 65160, options [mss 1460,sackOK,TS val 3144976216 ecr 315363091,nop,wscale 7], length 0
01:01:16.027254 IP trm.trimais.com.br.57320 > 138.197.150.181.ssh: Flags [.], ack 1, win 229, options [nop,nop,TS val 315363127 ecr 3144976216], length 0
01:01:16.038533 IP 138.197.150.181.ssh > trm.trimais.com.br.57320: Flags [P.], seq 1:42, ack 1, win 510, options [nop,nop,TS val 3144976371 ecr 315363127], length 41
01:01:16.181067 IP trm.trimais.com.br.57320 > 138.197.150.181.ssh: Flags [.], ack 42, win 229, options [nop,nop,TS val 315363165 ecr 3144976371], length 0
01:01:16.181102 IP trm.trimais.com.br.57320 > 138.197.150.181.ssh: Flags [P.], seq 1:22, ack 42, win 229, options [nop,nop,TS val 315363165 ecr 3144976371], length 21
01:01:16.181116 IP 138.197.150.181.ssh > trm.trimais.com.br.57320: Flags [.], ack 22, win 510, options [nop,nop,TS val 3144976513 ecr 315363165], length 0
01:01:16.182523 IP 138.197.150.181.ssh > trm.trimais.com.br.57320: Flags [P.], seq 42:1098, ack 22, win 510, options [nop,nop,TS val 3144976515 ecr 315363165], length 1056
01:01:16.327001 IP trm.trimais.com.br.57320 > 138.197.150.181.ssh: Flags [P.], seq 22:462, ack 1098, win 245, options [nop,nop,TS val 315363202 ecr 3144976515], length 440
01:01:16.327060 IP 138.197.150.181.ssh > trm.trimais.com.br.57320: Flags [.], ack 462, win 507, options [nop,nop,TS val 3144976659 ecr 315363202], length 0
01:01:16.469556 IP trm.trimais.com.br.57320 > 138.197.150.181.ssh: Flags [P.], seq 462:510, ack 1098, win 245, options [nop,nop,TS val 315363237 ecr 3144976659], length 48
01:01:16.469607 IP 138.197.150.181.ssh > trm.trimais.com.br.57320: Flags [.], ack 510, win 507, options [nop,nop,TS val 3144976802 ecr 315363237], length 0
01:01:16.478643 IP 138.197.150.181.ssh > trm.trimais.com.br.57320: Flags [P.], seq 1098:1378, ack 510, win 507, options [nop,nop,TS val 3144976811 ecr 315363237], length 280
01:01:16.623405 IP trm.trimais.com.br.57320 > 138.197.150.181.ssh: Flags [P.], seq 510:526, ack 1378, win 262, options [nop,nop,TS val 315363276 ecr 3144976811], length 16
01:01:16.623461 IP 138.197.150.181.ssh > trm.trimais.com.br.57320: Flags [.], ack 526, win 507, options [nop,nop,TS val 3144976955 ecr 315363276], length 0
01:01:16.765941 IP trm.trimais.com.br.57320 > 138.197.150.181.ssh: Flags [P.], seq 526:578, ack 1378, win 262, options [nop,nop,TS val 315363311 ecr 3144976955], length 52
01:01:16.765979 IP 138.197.150.181.ssh > trm.trimais.com.br.57320: Flags [.], ack 578, win 507, options [nop,nop,TS val 3144977098 ecr 315363311], length 0
01:01:16.766098 IP 138.197.150.181.ssh > trm.trimais.com.br.57320: Flags [P.], seq 1378:1430, ack 578, win 507, options [nop,nop,TS val 3144977098 ecr 315363311], length 52
01:01:16.908627 IP trm.trimais.com.br.57320 > 138.197.150.181.ssh: Flags [P.], seq 578:662, ack 1430, win 262, options [nop,nop,TS val 315363347 ecr 3144977098], length 84
01:01:16.951286 IP 138.197.150.181.ssh > trm.trimais.com.br.57320: Flags [.], ack 662, win 507, options [nop,nop,TS val 3144977283 ecr 315363347], length 0
01:01:19.144605 IP 68.183.55.223.52392 > 138.197.150.181.30313: Flags [S], seq 949868531, win 1024, length 0
01:01:19.831751 IP 138.197.150.181.ssh > trm.trimais.com.br.57320: Flags [P.], seq 1430:1498, ack 662, win 507, options [nop,nop,TS val 3144980164 ecr 315363347], length 68
01:01:19.974337 IP trm.trimais.com.br.57320 > 138.197.150.181.ssh: Flags [P.], seq 662:714, ack 1498, win 262, options [nop,nop,TS val 315364114 ecr 3144980164], length 52
01:01:19.974394 IP 138.197.150.181.ssh > trm.trimais.com.br.57320: Flags [.], ack 714, win 507, options [nop,nop,TS val 3144980306 ecr 315364114], length 0
01:01:19.974432 IP trm.trimais.com.br.57320 > 138.197.150.181.ssh: Flags [F.], seq 714, ack 1498, win 262, options [nop,nop,TS val 315364114 ecr 3144980164], length 0
01:01:19.977160 IP 138.197.150.181.ssh > trm.trimais.com.br.57320: Flags [F.], seq 1498, ack 715, win 507, options [nop,nop,TS val 3144980309 ecr 315364114], length 0
01:01:20.119646 IP trm.trimais.com.br.57320 > 138.197.150.181.ssh: Flags [.], ack 1499, win 262, options [nop,nop,TS val 315364150 ecr 3144980309], length 0
01:01:25.352155 IP dhcpc06adsl.econet.co.ls.52502 > 138.197.150.181.ssh: Flags [S], seq 1839167789, win 29200, options [mss 1460,sackOK,TS val 296796763 ecr 0,nop,wscale 7], length 0
01:01:25.352237 IP 138.197.150.181.ssh > dhcpc06adsl.econet.co.ls.52502: Flags [S.], seq 967070865, ack 1839167790, win 65160, options [mss 1460,sackOK,TS val 4164733000 ecr 296796763,nop,wscale 7], length 0
01:01:25.595878 IP dhcpc06adsl.econet.co.ls.52502 > 138.197.150.181.ssh: Flags [.], ack 1, win 229, options [nop,nop,TS val 296796824 ecr 4164733000], length 0
01:01:25.609267 IP 138.197.150.181.ssh > dhcpc06adsl.econet.co.ls.52502: Flags [P.], seq 1:42, ack 1, win 510, options [nop,nop,TS val 4164733257 ecr 296796824], length 41
01:01:25.853923 IP dhcpc06adsl.econet.co.ls.52502 > 138.197.150.181.ssh: Flags [.], ack 42, win 229, options [nop,nop,TS val 296796888 ecr 4164733257], length 0
01:01:25.855720 IP dhcpc06adsl.econet.co.ls.52502 > 138.197.150.181.ssh: Flags [P.], seq 1:22, ack 42, win 229, options [nop,nop,TS val 296796888 ecr 4164733257], length 21
01:01:25.855747 IP 138.197.150.181.ssh > dhcpc06adsl.econet.co.ls.52502: Flags [.], ack 22, win 510, options [nop,nop,TS val 4164733504 ecr 296796888], length 0
01:01:25.857207 IP 138.197.150.181.ssh > dhcpc06adsl.econet.co.ls.52502: Flags [P.], seq 42:1098, ack 22, win 510, options [nop,nop,TS val 4164733505 ecr 296796888], length 1056
01:01:26.102824 IP dhcpc06adsl.econet.co.ls.52502 > 138.197.150.181.ssh: Flags [P.], seq 22:462, ack 1098, win 251, options [nop,nop,TS val 296796950 ecr 4164733505], length 440
01:01:26.102875 IP 138.197.150.181.ssh > dhcpc06adsl.econet.co.ls.52502: Flags [.], ack 462, win 507, options [nop,nop,TS val 4164733751 ecr 296796950], length 0
01:01:26.348924 IP dhcpc06adsl.econet.co.ls.52502 > 138.197.150.181.ssh: Flags [P.], seq 462:510, ack 1098, win 251, options [nop,nop,TS val 296797012 ecr 4164733751], length 48
01:01:26.348976 IP 138.197.150.181.ssh > dhcpc06adsl.econet.co.ls.52502: Flags [.], ack 510, win 507, options [nop,nop,TS val 4164733997 ecr 296797012], length 0
01:01:26.357798 IP 138.197.150.181.ssh > dhcpc06adsl.econet.co.ls.52502: Flags [P.], seq 1098:1378, ack 510, win 507, options [nop,nop,TS val 4164734006 ecr 296797012], length 280
01:01:26.606046 IP dhcpc06adsl.econet.co.ls.52502 > 138.197.150.181.ssh: Flags [P.], seq 510:526, ack 1378, win 268, options [nop,nop,TS val 296797076 ecr 4164734006], length 16
01:01:26.606121 IP 138.197.150.181.ssh > dhcpc06adsl.econet.co.ls.52502: Flags [.], ack 526, win 507, options [nop,nop,TS val 4164734254 ecr 296797076], length 0
01:01:26.851087 IP dhcpc06adsl.econet.co.ls.52502 > 138.197.150.181.ssh: Flags [P.], seq 526:578, ack 1378, win 268, options [nop,nop,TS val 296797137 ecr 4164734254], length 52
01:01:26.851136 IP 138.197.150.181.ssh > dhcpc06adsl.econet.co.ls.52502: Flags [.], ack 578, win 507, options [nop,nop,TS val 4164734499 ecr 296797137], length 0
01:01:26.851338 IP 138.197.150.181.ssh > dhcpc06adsl.econet.co.ls.52502: Flags [P.], seq 1378:1430, ack 578, win 507, options [nop,nop,TS val 4164734499 ecr 296797137], length 52
01:01:27.095161 IP dhcpc06adsl.econet.co.ls.52502 > 138.197.150.181.ssh: Flags [P.], seq 578:662, ack 1430, win 268, options [nop,nop,TS val 296797199 ecr 4164734499], length 84
01:01:27.135304 IP 138.197.150.181.ssh > dhcpc06adsl.econet.co.ls.52502: Flags [.], ack 662, win 507, options [nop,nop,TS val 4164734783 ecr 296797199], length 0
01:01:30.018323 IP 138.197.150.181.ssh > dhcpc06adsl.econet.co.ls.52502: Flags [P.], seq 1430:1498, ack 662, win 507, options [nop,nop,TS val 4164737666 ecr 296797199], length 68
01:01:30.263835 IP dhcpc06adsl.econet.co.ls.52502 > 138.197.150.181.ssh: Flags [P.], seq 662:714, ack 1498, win 268, options [nop,nop,TS val 296797991 ecr 4164737666], length 52
01:01:30.263901 IP 138.197.150.181.ssh > dhcpc06adsl.econet.co.ls.52502: Flags [.], ack 714, win 507, options [nop,nop,TS val 4164737912 ecr 296797991], length 0
01:01:30.264755 IP dhcpc06adsl.econet.co.ls.52502 > 138.197.150.181.ssh: Flags [F.], seq 714, ack 1498, win 268, options [nop,nop,TS val 296797991 ecr 4164737666], length 0
01:01:30.266675 IP 138.197.150.181.ssh > dhcpc06adsl.econet.co.ls.52502: Flags [F.], seq 1498, ack 715, win 507, options [nop,nop,TS val 4164737915 ecr 296797991], length 0
01:01:30.510817 IP dhcpc06adsl.econet.co.ls.52502 > 138.197.150.181.ssh: Flags [.], ack 1499, win 268, options [nop,nop,TS val 296798053 ecr 4164737915], length 0
01:01:32.067623 IP kraken-2-0-9400-20000-ams3-0.0.0.0-0.61953 > 138.197.150.181.9400: Flags [S], seq 3078415054, win 1024, length 0
01:01:33.097207 IP 154.221.25.230.49086 > 138.197.150.181.ssh: Flags [S], seq 3186275732, win 29200, options [mss 1460,sackOK,TS val 1519889797 ecr 0,nop,wscale 7], length 0
01:01:33.097282 IP 138.197.150.181 > 154.221.25.230: ICMP 138.197.150.181 tcp port ssh unreachable, length 68
01:01:48.704613 IP 111.231.228.239.60630 > 138.197.150.181.ssh: Flags [S], seq 295060588, win 29200, options [mss 1424,sackOK,TS val 4080475026 ecr 0,nop,wscale 7], length 0
01:01:48.704663 IP 138.197.150.181 > 111.231.228.239: ICMP 138.197.150.181 tcp port ssh unreachable, length 68
01:01:50.240468 IP 45.135.232.21.49365 > 138.197.150.181.2404: Flags [S], seq 1907806091, win 1024, length 0
01:01:54.367370 IP 98-233-213-49.tinp.net.tw.19278 > 138.197.150.181.telnet: Flags [S], seq 2328204981, win 9658, length 0
01:02:05.082341 IP 104.131.89.163.53852 > 138.197.150.181.ssh: Flags [S], seq 4152441006, win 29200, options [mss 1460,sackOK,TS val 1731598736 ecr 0,nop,wscale 7], length 0
01:02:05.082430 IP 138.197.150.181 > 104.131.89.163: ICMP 138.197.150.181 tcp port ssh unreachable, length 68
01:02:05.091311 IP 138.197.150.181.ssh > 104.131.89.163.46616: Flags [P.], seq 3246924511:3246924579, ack 221376675, win 507, options [nop,nop,TS val 4177702912 ecr 1731569423], length 68
01:02:05.104582 IP 104.131.89.163.46616 > 138.197.150.181.ssh: Flags [R], seq 221376675, win 0, length 0
01:02:05.104652 IP 138.197.150.181 > 104.131.89.163: ICMP 138.197.150.181 tcp port ssh unreachable, length 48
01:02:05.366011 IP 59.16.243.198.59137 > 138.197.150.181.http: Flags [S], seq 1705544111, win 64240, options [mss 1460,nop,wscale 8,nop,nop,sackOK], length 0
01:02:05.366101 IP 138.197.150.181.http > 59.16.243.198.59137: Flags [S.], seq 2481928089, ack 1705544112, win 64240, options [mss 1460,nop,nop,sackOK,nop,wscale 7], length 0
01:02:05.567608 IP 59.16.243.198.59137 > 138.197.150.181.http: Flags [.], ack 1, win 1026, length 0
01:02:05.568020 IP 59.16.243.198.59137 > 138.197.150.181.http: Flags [P.], seq 1:114, ack 1, win 1026, length 113: HTTP: CONNECT www.naver.com:80 HTTP/1.1
01:02:05.568070 IP 138.197.150.181.http > 59.16.243.198.59137: Flags [.], ack 114, win 501, length 0
01:02:05.568455 IP 138.197.150.181.http > 59.16.243.198.59137: Flags [P.], seq 1:504, ack 114, win 501, length 503: HTTP: HTTP/1.1 405 Method Not Allowed
01:02:05.770456 IP 59.16.243.198.59137 > 138.197.150.181.http: Flags [F.], seq 114, ack 504, win 1024, length 0
01:02:05.770592 IP 138.197.150.181.http > 59.16.243.198.59137: Flags [F.], seq 504, ack 115, win 501, length 0
01:02:05.971838 IP 59.16.243.198.59137 > 138.197.150.181.http: Flags [.], ack 505, win 1024, length 0
01:02:07.839812 IP 138.197.150.181.ssh > 104.131.89.163.46616: Flags [F.], seq 68, ack 1, win 507, options [nop,nop,TS val 4177705661 ecr 1731569423], length 0
01:02:07.852569 IP 104.131.89.163.46616 > 138.197.150.181.ssh: Flags [R], seq 221376675, win 0, length 0
01:02:07.852649 IP 138.197.150.181 > 104.131.89.163: ICMP 138.197.150.181 tcp port ssh unreachable, length 48
01:02:14.908361 IP scanner-12.ch1.censys-scanner.com.14215 > 138.197.150.181.3065: Flags [S], seq 1095049311, win 1024, options [mss 1460], length 0
